{
  "run_id": "run-20251224114904-ir3l9j",
  "run_name": "Default Benchmark Run",
  "run_description": "Standard benchmark run with all enabled questions and models",
  "created_at": "2025-12-24T11:49:04.330Z",
  "completed_at": "2025-12-24T11:52:07.868Z",
  "git_sha": "ee23ee2c6d8c80969f09025e141fd8f4cbcb9897",
  "languages_available": [
    "en",
    "pt-BR"
  ],
  "models_included": [
    {
      "provider_id": "openrouter",
      "model_id": "deepseek/deepseek-chat",
      "display_name": "DeepSeek V3 (via OpenRouter)"
    }
  ],
  "question_ids": [
    "q1-diagnosis",
    "q2-causality",
    "q3-solutions"
  ],
  "file_map": {
    "snapshots": {
      "questions": "questions.snapshot.json",
      "eval_prompts": "eval_prompts.snapshot.json",
      "providers": "providers.snapshot.json"
    },
    "per_question": {
      "q1-diagnosis": "per_question/q1-diagnosis.json",
      "q2-causality": "per_question/q2-causality.json",
      "q3-solutions": "per_question/q3-solutions.json"
    },
    "per_model": {
      "q1-diagnosis": {
        "openrouter__deepseek__deepseek-chat": "per_model/q1-diagnosis/openrouter__deepseek__deepseek-chat.json"
      },
      "q2-causality": {
        "openrouter__deepseek__deepseek-chat": "per_model/q2-causality/openrouter__deepseek__deepseek-chat.json"
      },
      "q3-solutions": {
        "openrouter__deepseek__deepseek-chat": "per_model/q3-solutions/openrouter__deepseek__deepseek-chat.json"
      }
    }
  },
  "stats": {
    "total_questions": 3,
    "total_models": 1,
    "total_evaluations": 3,
    "succeeded": 3,
    "failed": 0,
    "total_duration_ms": 96693
  }
}