{
  "run_id": "run-20251228155558-ee3540",
  "run_name": "Default Benchmark Run",
  "run_description": "Standard benchmark run with all enabled questions and models",
  "created_at": "2025-12-28T15:55:58.137Z",
  "completed_at": "2025-12-28T16:09:19.310Z",
  "git_sha": "eaa4290c32b25044f40160dd1aff63eb051ac1e9",
  "languages_available": [
    "en",
    "pt-BR"
  ],
  "models_included": [
    {
      "provider_id": "deepseek",
      "model_id": "deepseek-chat",
      "display_name": "DeepSeek Chat"
    },
    {
      "provider_id": "deepseek",
      "model_id": "deepseek-reasoner",
      "display_name": "DeepSeek Reasoner"
    }
  ],
  "question_ids": [
    "q1-diagnosis",
    "q2-causality",
    "q3-solutions"
  ],
  "file_map": {
    "snapshots": {
      "questions": "questions.snapshot.json",
      "eval_prompts": "eval_prompts.snapshot.json",
      "providers": "providers.snapshot.json"
    },
    "per_question": {
      "q1-diagnosis": "per_question/q1-diagnosis.json",
      "q2-causality": "per_question/q2-causality.json",
      "q3-solutions": "per_question/q3-solutions.json"
    },
    "per_model": {
      "q1-diagnosis": {
        "deepseek__deepseek-chat": "per_model/q1-diagnosis/deepseek__deepseek-chat.json",
        "deepseek__deepseek-reasoner": "per_model/q1-diagnosis/deepseek__deepseek-reasoner.json"
      },
      "q2-causality": {
        "deepseek__deepseek-chat": "per_model/q2-causality/deepseek__deepseek-chat.json",
        "deepseek__deepseek-reasoner": "per_model/q2-causality/deepseek__deepseek-reasoner.json"
      },
      "q3-solutions": {
        "deepseek__deepseek-chat": "per_model/q3-solutions/deepseek__deepseek-chat.json",
        "deepseek__deepseek-reasoner": "per_model/q3-solutions/deepseek__deepseek-reasoner.json"
      }
    }
  },
  "stats": {
    "total_questions": 3,
    "total_models": 2,
    "total_evaluations": 6,
    "succeeded": 5,
    "failed": 1,
    "total_duration_ms": 256005
  }
}